{
  "collection_id": "sha256:cccccccccccccccccccccccccccccccccccccccccccccccccccccccccccccccc",
  "protocol": "qsol-control-collection/1",
  "name": "Quantum evidence archive",
  "created_at": "2026-08-18T07:44:00+09:30",
  "privacy_class": "INTERNAL",
  "retention_class": "ARCHIVE",
  "metadata": {"purpose": "persistent searchable research corpus"}
}
